{
  "catalog": "EnterpriseIntegration",
  "name": "MessageTranslator",
  "summary": "Converts a message from one data format to another, so that applications with different formats can talk without either being changed.",
  "reference": {
    "author": "Gregor Hohpe, Bobby Woolf",
    "work": "Enterprise Integration Patterns",
    "year": 2003
  },
  "inherited": false,
  "roles": [
    {
      "name": "MessageTranslator",
      "targets": [
        "Interface",
        "Class"
      ],
      "repeatable": false,
      "summary": "The participant that changes a message's format and not its route. It is the counterpart of a router, and keeping the two apart is what lets a pipeline be reasoned about: one step changes where, the other changes what.",
      "links": []
    }
  ]
}
