{
  "catalog": "GangOfFour",
  "name": "Composite",
  "summary": "Composes objects into tree structures to represent part-whole hierarchies, and lets clients treat individual objects and compositions uniformly.",
  "reference": {
    "author": "Erich Gamma, Richard Helm, Ralph Johnson, John Vlissides",
    "work": "Design Patterns",
    "year": 1994
  },
  "inherited": false,
  "roles": [
    {
      "name": "Component",
      "targets": [
        "Interface",
        "Class"
      ],
      "repeatable": true,
      "summary": "Declares the interface shared by the leaves and the composites of the tree.",
      "links": []
    },
    {
      "name": "Leaf",
      "targets": [
        "Class",
        "Struct"
      ],
      "repeatable": true,
      "summary": "A terminal element of the tree: it has no children.",
      "links": [
        "Component"
      ]
    },
    {
      "name": "Composite",
      "targets": [
        "Class"
      ],
      "repeatable": true,
      "summary": "An element that holds other components and delegates the work to them.",
      "links": [
        "Component"
      ]
    }
  ]
}
